Case Number,Case Name,County,Case Type
25CV56583,"Celia Parra vs Anastasia Horsey, Farmers Direct Property and Casualty Insurance Company",Jackson,Tort - GeneralOpen
25CV56636,"Carman Delpizzo vs Mitchell Jacob Vogel, Elizabet Vogel",Jackson,Tort - GeneralOpen
25CV56706,Cindy Valencia vs Jeff Hollister,Jackson,Tort - GeneralOpen
25CV56709,Leonard Boyd vs Sheriff Nate Sickler,Jackson,Tort - GeneralOpen
25CV56723,"Levi Roberts vs  Ace Interstate Moving LLC,  Royal Moving and Storage LLC",Jackson,Tort - GeneralOpen
