Case Number,Case Name,County,Case Type
25CV32588,"Carlos Martin vs CAMCO LLC, Phillip Cam",Jackson,Tort - GeneralOpen
25CV32630,"The Foundation of Human Understanding, Richard Alan Masters vs Conde T Cox, Esq, Patrick J Kelly, Esq, Jason D Hayward, Esq, Hayward Law Firm, LLC, Douglas Pahl, Esqetal.",Josephine,Tort - Malpractice LegalOpen
25CV32674,"James Fellenbaum vs Axis Health, Inc., Jennifer Long, John Doe",Josephine,Tort - Malpractice MedicalOpen
25CV32727,"MALACHI CARTER vs State of Oregon, Department of Human Services",Josephine,Tort - GeneralOpen
25CV32760,"Brophy Ranch, LLC, Christopher Barton vs Justin N Rosas,  The Law Office of Justin Rosas",Jackson,Tort - Malpractice LegalOpen
